Boutique 444 Venice Beach,90291.0,510.0,8.8,9.1,8.8,8.9,8.5,8.1,9.3,9.2,0,1,0,1,1,0,0,1,0,0,0,0,0,1,0,0,0,13.0,2
Charlie Chaplin Historic Hollywood Home,90028.0,15.0,8.3,7.5,8.7,8.5,8.3,8.2,7.5,8.8,1,0,0,1,0,0,0,1,0,0,0,0,0,1,0,0,0,6.2,0
Downtown LA Paradise Resort Suite,90017.0,28.0,8.5,8.8,8.9,8.5,8.0,8.4,10.0,8.7,1,0,0,1,0,0,0,1,0,0,1,0,0,1,0,1,0,1.2,2
"The Ritz-Carlton, Marina del Rey",90292.0,257.0,8.5,9.0,8.8,8.6,8.9,7.3,6.0,8.5,0,0,0,0,1,1,0,0,0,0,1,0,1,1,0,1,0,12.4,0
Urban Two Level Bellagio Penthouse,90017.0,13.0,9.2,8.5,9.6,8.5,9.6,9.6,10.0,9.2,0,1,0,0,1,0,0,1,0,0,1,0,0,1,0,1,0,1.0,2
Urban Downtown LA Elegant Suite Los Angeles,90017.0,27.0,8.8,9.3,8.6,9.0,8.8,8.2,10.0,9.1,0,0,1,0,1,0,0,1,0,0,1,0,0,1,0,1,0,0.9,2
Heart of Hollywood,90028.0,36.0,8.5,8.3,8.4,8.5,8.8,7.9,10.0,9.4,1,0,0,0,0,0,1,1,0,0,0,0,0,1,0,0,0,6.2,2
Popular Downtown LA Spectacular Suite,90015.0,9.0,9.0,9.2,9.2,8.9,9.2,8.6,8.9,5.0,1,0,0,1,0,0,0,1,0,0,1,0,0,1,0,1,0,1.2,1
Holiday Inn Express Hollywood Walk of Fame,90068.0,1172.0,8.0,8.1,8.1,7.6,8.4,7.2,7.7,8.8,0,0,1,1,1,0,0,1,0,0,0,0,0,1,0,1,0,6.2,0
Urban Hollywood James Bond Suite,90028.0,7.0,8.5,8.6,8.6,8.9,8.6,8.2,7.9,4.0,0,1,0,0,1,0,0,1,0,0,1,0,0,1,0,1,0,6.2,1
Kings Home,90069.0,9.0,9.2,8.9,9.2,9.7,8.9,8.9,9.5,7.0,1,0,0,1,0,0,1,1,0,1,0,0,0,1,0,0,0,7.5,2
Sunset Tower Hotel,90069.0,112.0,8.7,9.1,8.9,8.3,8.9,7.9,8.9,9.2,0,0,0,1,1,0,0,1,0,1,0,0,1,1,0,1,0,7.5,2
Urban Dtla Two Level Fashion Loft,90015.0,9.0,9.5,9.7,9.7,9.2,9.5,8.9,10.0,9.7,0,0,1,0,1,0,0,1,0,0,1,0,0,1,0,1,0,1.5,2
2 Bedroom Celebrity Loft,90017.0,27.0,9.0,8.9,8.9,9.0,9.1,8.9,10.0,9.0,1,0,1,0,0,0,0,1,0,0,1,0,0,1,0,1,0,1.0,2
Downtown L.A. Resort Comfort Life and 4Beds,90015.0,26.0,8.9,8.9,9.0,9.1,9.0,8.4,8.5,9.2,1,0,0,0,0,0,0,1,0,0,1,0,0,1,1,1,0,1.1,2
Popular Downtown LA Luxury Palazzo Resort Style Suite,90012.0,24.0,8.5,8.5,8.3,8.6,8.7,8.2,10.0,8.7,1,0,0,0,0,0,0,1,0,0,1,0,0,1,1,1,0,0.8,2
Urban Hollywood Blvd Grammys Suite,90028.0,32.0,8.6,8.4,8.8,8.8,8.5,8.2,10.0,8.7,1,0,1,0,0,0,0,1,0,0,1,0,0,1,0,1,0,5.6,2
Courtyard by Marriott Los Angeles L.A. LIVE,90015.0,219.0,8.6,9.0,8.8,8.7,8.8,7.5,8.5,8.8,0,0,1,1,1,0,0,1,0,0,0,0,1,1,0,1,0,1.4,2
Hollywood 6 beds Vip Pool Suite,90028.0,30.0,8.0,8.2,8.1,8.4,7.7,7.4,9.5,8.2,0,1,0,0,1,0,0,1,0,0,1,0,0,1,0,1,0,5.6,2
Popular Downtown LA Bellagio Resort Suite,90017.0,34.0,7.9,7.5,7.9,7.7,8.2,7.6,9.2,8.4,1,0,0,1,0,0,0,1,0,0,1,0,0,1,0,1,0,1.2,0
Urban Downtown LA Chanel Suite,90017.0,33.0,8.7,8.6,8.6,9.0,8.8,8.3,9.7,9.0,0,1,1,0,1,0,0,1,0,0,0,1,0,1,0,0,0,0.9,2
Charming and Lovely apt!,90036.0,20.0,8.8,9.0,8.5,8.4,8.4,8.8,10.0,9.5,1,0,0,0,0,1,0,1,0,1,0,0,0,0,0,0,0,5.6,2
"Tilt Hotel Universal Hollywood, an Ascend Hotel Collection Member",90068.0,694.0,7.9,8.0,8.0,7.6,8.2,7.1,8.3,8.4,0,1,0,0,1,0,0,1,0,0,0,0,0,0,0,1,0,7.5,0
AKA Beverly Hills,90210.0,26.0,9.3,9.2,9.6,9.1,9.5,8.9,8.8,9.6,0,0,1,1,1,0,0,1,0,1,0,0,0,1,0,0,0,8.7,2
Popular Downtown LA VIP Modern High Rise Suite,90015.0,19.0,8.8,8.7,8.6,8.7,9.0,8.4,8.5,9.4,1,0,0,1,0,0,0,1,0,0,1,0,0,1,0,1,0,1.1,2
Popular DTLA Designer Suite With Massive Views,90015.0,41.0,8.8,8.4,8.8,9.1,8.8,8.4,8.8,9.3,1,0,0,0,0,0,0,1,1,0,1,0,0,1,0,1,0,1.3,2
Urban Hollywood Oscars Suite,90028.0,11.0,8.6,8.6,8.9,8.4,9.1,7.7,6.3,8.6,0,0,1,0,1,0,0,1,0,0,1,0,0,1,0,1,0,5.6,0
Millennium Biltmore Los Angeles,90071.0,1275.0,8.1,8.3,8.1,8.0,8.2,7.3,7.9,8.5,0,0,1,1,1,0,0,1,0,0,0,0,1,1,0,1,0,0.7,0
Urban Hollywood Universal Studios Suite,90028.0,29.0,8.5,8.4,8.5,8.7,9.1,7.8,8.7,8.6,1,0,0,1,0,0,0,1,0,0,1,0,0,1,0,1,0,6.2,2
Global Luxury Suites at Wilshire,90036.0,12.0,8.5,9.4,9.2,8.3,7.5,7.7,8.1,8.6,0,0,0,1,1,0,0,1,0,0,1,0,0,1,0,1,0,5.6,2
"H Hotel Los Angeles, Curio Collection By Hilton",90045.0,690.0,8.9,9.3,9.2,8.8,8.7,8.2,8.6,8.9,0,0,0,0,1,0,0,1,0,0,0,0,1,1,0,1,0,11.2,2
Urban DTLA Corporate Executive Suite,90017.0,7.0,8.5,8.9,8.6,8.6,8.6,7.9,8.6,5.0,0,0,0,1,1,0,0,1,0,0,1,0,0,1,0,1,0,1.1,1
Popular Downtown LA Parlor Resort Style Suite,90012.0,15.0,7.9,7.7,8.5,7.9,7.9,7.5,3.8,7.8,1,0,0,1,0,0,0,1,0,0,1,0,0,1,0,1,0,0.8,0
Venice Style Studio Venice Beach,90292.0,14.0,8.3,8.6,8.0,8.2,8.5,7.0,9.3,7.0,1,0,1,0,0,0,0,1,0,0,1,0,0,1,0,1,0,13.0,0
Downtown LA Clean and Cozy Suite,90017.0,5.0,8.7,9.0,9.5,9.5,6.5,8.0,10.0,3.0,1,0,1,0,0,0,1,1,0,0,1,0,0,0,0,1,0,1.1,1
JW Marriott Los Angeles L.A. LIVE,90015.0,638.0,8.8,9.1,9.0,8.8,8.8,7.8,8.1,9.1,0,0,0,1,1,0,0,1,0,0,0,0,1,1,0,1,0,1.5,2
Hollywood Blvd Exclusive Apartment,90028.0,13.0,8.4,8.9,9.1,8.5,6.9,7.5,8.8,9.4,1,0,1,0,0,0,0,1,0,0,0,1,0,1,0,0,0,6.2,2
Urban Downtown LA Modern Suite,90017.0,8.0,9.1,9.1,9.4,9.4,8.8,8.5,9.4,7.0,0,0,1,0,1,0,0,1,0,0,1,0,0,1,0,1,0,1.0,2
Glendon Apartments,90024.0,154.0,8.1,7.9,8.2,7.9,7.9,7.4,9.4,9.0,0,1,0,0,1,0,1,1,0,0,0,0,0,0,0,0,0,11.2,0
"SLS Hotel, a Luxury Collection Hotel, Beverly Hills",90048.0,686.0,8.2,8.5,8.3,8.1,8.5,7.1,6.3,8.5,0,0,0,1,1,0,0,0,0,0,1,0,1,1,0,1,0,7.5,0
Beverly Hills Marriott,90035.0,385.0,7.9,8.4,8.2,7.8,8.1,6.9,7.4,8.1,0,1,0,0,1,0,0,1,0,0,0,0,1,1,0,1,0,8.7,0
Los Comfy Apartment,90017.0,12.0,9.1,9.4,9.2,9.0,8.8,9.0,9.4,8.0,1,0,1,1,0,0,0,1,0,0,0,0,0,1,0,1,0,1.1,2
LA Luxury Suite at The Grove | 2BR&2BT | Pool | Free Parking,90036.0,9.0,8.6,8.6,8.3,8.6,8.6,8.3,8.9,5.0,1,0,1,0,0,0,0,1,0,0,1,0,0,1,0,1,0,5.6,1
Downtown LA Luxe Staples Center Suite,90015.0,16.0,8.1,8.3,7.8,8.0,7.5,8.0,10.0,8.9,1,0,1,0,0,0,0,1,0,0,1,0,0,1,0,1,0,1.2,2
"WeHo Palace, 2 Bedroom 2 Full Bath",90046.0,23.0,8.1,8.3,8.1,7.8,7.7,8.1,10.0,8.8,1,0,0,0,0,0,1,1,0,0,0,0,0,1,0,0,0,6.8,2
Chic 2 Bedroom/2 Bathroom Suite at the Beach,90292.0,15.0,7.3,6.8,8.2,7.5,8.0,6.7,6.8,2.0,1,0,1,0,0,0,0,1,0,0,1,0,0,1,0,1,0,12.4,1
Oceana Beach Club Hotel,90403.0,395.0,8.2,8.7,8.4,8.0,8.4,6.8,8.6,8.7,0,0,1,1,1,0,0,1,0,0,0,0,1,1,0,0,0,14.9,0
Popular Hollywood and The Grove Luxury Pavilion Resort Style Suite,90036.0,24.0,7.6,7.3,7.6,7.8,6.8,7.2,9.2,8.7,1,0,1,0,0,0,0,1,0,0,1,0,0,1,0,1,0,6.2,0
Urban Dtla Paradise Suite,90017.0,7.0,8.6,9.7,8.6,8.6,9.3,7.5,7.9,3.0,0,0,1,0,1,0,0,1,0,0,1,0,0,1,0,1,0,1.1,1
"Prime West Hollywood, Gorgeous & Renovated 2 Bed 2 Bath",90046.0,13.0,7.9,7.9,8.1,7.7,8.1,7.7,10.0,8.1,1,0,0,0,0,0,1,1,0,0,0,0,0,0,0,0,0,6.8,2
Live like a Hollywood Celebrity,90068.0,21.0,7.6,8.1,7.0,7.0,7.9,7.3,8.3,9.0,1,0,0,1,0,0,1,1,0,0,0,0,0,1,0,0,0,5.6,0
Living The LA Dream 2 bed 2 bath,90015.0,13.0,8.6,8.9,8.7,8.5,8.4,7.9,9.1,8.0,0,1,0,0,1,0,0,1,0,0,1,0,0,1,0,1,0,1.1,2
The Westin Bonaventure Hotel & Suites,90071.0,715.0,8.3,8.7,8.5,8.3,8.5,7.5,8.7,8.5,0,0,0,1,1,0,0,1,0,0,1,0,1,1,0,1,0,0.8,2
Executive Lifestyle Apartment,90017.0,111.0,8.7,8.5,8.9,8.9,8.7,8.7,8.1,8.6,1,0,0,1,0,0,0,1,0,0,1,0,0,1,0,1,0,0.9,2
Kimpton Hotel Wilshire,90048.0,300.0,8.1,8.4,8.4,7.8,8.5,7.1,6.4,8.0,0,0,0,0,1,0,0,0,0,1,1,0,1,1,0,1,0,6.8,0
Downtown LA Modern Staples Center Suite,90015.0,16.0,8.4,8.9,8.3,8.0,8.0,8.1,8.8,8.9,1,0,1,0,0,0,0,1,0,0,1,0,0,1,0,1,0,1.3,2
"Channel Road Inn, A Four Sisters Inn",90402.0,111.0,9.2,9.6,9.4,9.3,9.6,8.2,8.7,9.1,1,0,0,0,0,0,0,1,0,0,0,1,0,1,1,0,0,15.5,2
Venice Beach Vacation Condos,90291.0,252.0,8.3,8.6,8.4,8.3,8.0,7.7,8.7,8.8,0,0,0,1,1,0,0,1,1,0,0,0,0,1,0,0,0,13.7,2
American Hotel,90013.0,1449.0,8.1,8.5,8.0,7.7,8.7,8.0,8.6,8.0,0,0,0,1,0,0,1,1,0,0,0,0,0,1,0,0,0,0.7,0
Hilton Garden Inn Los Angeles / Hollywood,90068.0,384.0,7.9,8.2,7.8,7.7,8.2,7.0,7.7,8.6,0,0,1,0,1,0,0,1,0,0,1,0,1,1,0,1,0,6.2,0
Urban DTLA Two Level Staples Center Loft,90015.0,10.0,9.2,9.5,9.3,9.3,9.3,8.8,9.0,7.0,0,0,1,0,1,0,0,1,0,0,1,0,0,1,0,1,0,1.5,2
"Santa Monica Duplex, 3 Bed 2 Bath",90404.0,12.0,8.0,8.6,8.6,7.3,8.1,7.3,8.3,4.0,1,0,0,0,0,0,0,1,1,0,0,0,0,1,1,0,0,12.4,1
Popular Downtown LA Venetian Resort Style Suite,90012.0,22.0,7.6,7.7,7.5,7.5,8.2,7.2,10.0,7.6,1,0,0,0,0,0,0,1,0,0,1,0,0,1,1,1,0,0.7,0
Popular Downtown LA Splendid Suite,90015.0,25.0,8.6,8.8,8.8,8.5,8.4,7.9,8.6,8.9,1,0,1,0,0,0,0,1,0,0,1,0,0,1,0,1,0,1.2,2
Franklin Tower,90028.0,34.0,8.7,8.5,8.8,8.9,8.5,8.2,9.4,9.1,1,0,0,0,0,0,0,1,0,1,1,0,1,1,0,1,0,5.6,2
Downtown LA Serene Penthouse,90012.0,38.0,8.1,7.8,8.5,8.1,7.8,8.0,10.0,8.2,1,0,0,1,0,0,0,1,0,0,1,0,0,1,0,1,0,0.7,2
W Los Angeles – West Beverly Hills,90024.0,363.0,7.7,8.0,7.9,7.5,7.9,6.5,5.0,8.4,0,0,0,1,1,0,0,0,0,0,1,0,1,1,0,1,0,11.2,0
Urban Hollywood Two Level Penthouse,90028.0,20.0,9.2,9.0,9.3,9.0,9.4,8.8,9.8,8.6,0,0,1,0,1,0,0,1,0,0,1,0,0,1,0,1,0,6.2,2
Selby Ave Guest House,90064.0,75.0,10.0,10.0,9.9,10.0,9.9,9.9,10.0,9.9,1,0,0,0,0,0,0,1,0,0,1,0,0,1,1,1,0,9.9,2
L.A. CITY LIFE HIGHRISE VIEWS - 5 BEDS,90015.0,5.0,8.4,8.5,8.5,8.5,8.5,8.5,8.0,2.0,1,0,1,0,0,0,0,1,0,0,1,1,0,0,0,1,0,1.1,1
Downtown LA Dazzling Apartment,90017.0,6.0,8.2,9.2,8.3,7.5,7.9,7.9,7.5,8.3,1,0,1,0,0,0,0,1,0,0,1,0,0,1,0,1,0,1.2,0
Urban Hollywood Celebrity Suite,90028.0,18.0,8.5,8.2,8.6,8.8,8.8,8.1,9.2,8.6,0,0,0,1,1,0,0,1,0,0,1,0,0,1,0,1,0,6.2,2
Hollywood Historic Hotel,90038.0,1686.0,7.7,7.9,7.5,7.2,8.5,7.4,8.6,7.8,0,1,0,1,1,0,0,1,0,0,0,0,1,1,0,0,1,4.3,0
Hilton Los Angeles Airport,90045.0,4004.0,7.7,8.1,7.9,7.6,7.9,7.0,5.6,7.9,0,0,0,1,1,0,0,0,0,0,1,0,1,0,0,1,0,10.6,0
Hollywood Hotel - The Hotel of Hollywood Near Universal Studios,90029.0,2206.0,7.8,8.0,7.9,7.7,8.1,7.5,7.9,7.5,0,0,0,1,1,1,0,1,0,0,1,0,1,0,0,1,0,3.7,0
Renaissance Los Angeles Airport Hotel,90045.0,964.0,7.9,8.3,8.1,7.9,8.2,7.1,6.2,8.1,0,0,0,0,1,0,0,1,0,0,1,0,1,1,0,1,0,10.6,0
Popular Hollywood Blvd Superstar Suite,90028.0,11.0,7.8,8.2,8.2,8.2,6.6,7.3,8.2,6.0,1,0,1,0,0,0,0,1,0,0,0,1,0,1,0,1,0,6.2,0
Hollywood Blvd Stars Suite,90028.0,44.0,7.8,7.8,7.6,7.6,7.4,7.3,8.0,9.0,1,0,0,1,0,0,0,1,0,0,1,0,0,1,0,1,0,6.2,0
The Hotel Hollywood,90028.0,2632.0,8.0,8.2,7.5,7.3,8.9,7.5,7.8,8.5,0,0,0,0,1,0,1,1,1,0,0,1,0,1,0,0,0,5.6,0
Popular Hollywood Blvd James Dean Suite,90028.0,15.0,8.1,7.3,8.7,8.3,7.2,7.7,10.0,9.2,1,0,1,0,0,0,0,1,0,0,1,0,0,1,0,1,0,6.2,2
The Grove Luxe Apartment,90036.0,10.0,8.1,8.3,8.0,8.0,8.1,7.5,7.5,8.8,1,0,1,0,0,0,0,1,0,0,1,0,0,1,0,1,0,6.2,0
Four Points by Sheraton Los Angeles International Airport,90045.0,5880.0,7.6,7.8,7.5,7.3,8.0,6.9,7.6,8.0,0,0,0,1,1,0,0,1,0,0,1,0,1,0,0,1,0,10.6,0
Popular Hollywood Boulevard Of Stars 2BR/BA Suite,90028.0,30.0,8.1,7.8,8.3,8.2,7.7,7.5,8.9,8.6,1,0,1,0,0,0,0,1,0,0,1,0,0,1,0,1,0,5.6,0
Comfort Inn Santa Monica - West Los Angeles,90404.0,610.0,7.8,8.2,7.9,7.6,8.0,7.3,7.9,7.9,1,0,0,0,0,0,0,1,0,0,1,0,0,0,0,1,0,13.0,0
Downtown LA Convention Center Elite Apartment,90015.0,14.0,8.7,8.9,8.5,9.1,8.2,8.5,6.7,9.2,0,0,1,0,1,0,0,1,0,0,1,0,0,1,0,1,0,1.7,0
Modern Apartments in Downtown LA,90017.0,101.0,7.6,7.7,8.0,7.8,7.1,7.0,9.2,8.1,0,0,0,1,0,0,0,1,0,1,0,0,0,1,0,0,0,1.1,0
Artist Home at Venice Beach - One Bedroom Oasis,90292.0,20.0,7.2,6.8,6.6,6.4,8.4,6.6,8.5,4.0,1,0,0,1,0,0,0,1,0,0,1,0,1,1,0,1,0,13.0,1
Beverly Hills Celebrity Home,90035.0,168.0,8.9,9.1,8.9,9.0,8.8,8.6,9.3,9.3,1,0,0,0,0,0,0,1,0,0,1,0,0,1,1,1,0,8.7,2
Mondrian Los Angeles in West Hollywood,90069.0,732.0,7.7,8.0,7.9,7.5,7.7,6.6,5.7,8.5,0,0,0,1,1,0,0,1,0,1,0,0,1,1,0,1,0,8.1,0
DoubleTree by Hilton Hotel Los Angeles - Westside,90230.0,892.0,7.7,8.0,7.9,7.6,8.1,6.9,7.5,7.5,0,0,1,1,1,0,0,1,0,0,0,0,1,1,0,1,0,9.9,0
DOWNTOWN L.A. SKY VIEW PENTHOUSE & 4 BEDS,90017.0,12.0,8.2,7.7,8.6,8.3,7.3,8.1,9.4,5.0,1,0,0,0,0,0,0,1,0,0,1,0,0,1,1,1,0,1.0,1
Hotel MDR Marina del Rey- a DoubleTree by Hilton,90292.0,679.0,7.8,8.1,8.0,7.7,8.2,6.7,7.8,7.9,0,0,0,1,1,0,0,1,0,1,0,0,0,1,0,1,0,11.8,0
Super Lovely Studio Apartment,90020.0,5.0,9.0,8.0,9.5,9.0,9.5,9.0,9.0,4.0,0,0,0,0,0,0,0,1,0,0,0,0,0,1,0,0,0,3.7,1
Angel City Spacious Apartment,90017.0,15.0,8.3,8.8,8.5,8.2,8.2,7.8,7.5,8.2,1,0,1,1,0,0,0,1,0,0,0,0,0,1,0,1,0,1.1,0
Hollywood 7 Bed Penthouse Superstar,90028.0,38.0,7.7,7.4,7.6,7.4,8.1,7.1,8.8,8.7,0,1,0,0,1,0,0,1,0,0,1,0,0,1,0,1,0,5.6,0
Doubletree by Hilton Los Angeles Downtown,90012.0,693.0,7.8,8.3,8.1,7.7,8.1,6.9,6.1,7.8,0,1,0,1,1,0,0,0,0,0,0,0,1,1,0,0,0,650.0,0
Hollywood Walk of Fame 5beds Studio,90028.0,13.0,8.0,8.1,8.1,7.7,8.3,7.5,7.5,8.6,0,1,1,0,1,0,0,1,0,0,0,0,0,1,0,0,0,6.2,0
Downtown LA 5Beds Spectacular Pool,90017.0,8.0,7.5,8.5,8.5,7.5,6.9,6.3,7.5,7.2,0,0,0,1,1,0,0,1,0,0,1,0,0,1,0,1,0,1.3,0
Studio City Warm Apartment,91604.0,10.0,7.6,7.8,7.0,6.8,8.0,6.5,9.3,4.0,1,0,0,1,0,0,0,1,0,0,1,0,0,1,0,1,0,9.3,1
Chic and Charming 1 bdr,90046.0,70.0,7.9,7.7,7.8,7.7,7.9,7.5,8.6,8.9,1,0,0,1,0,1,0,1,0,0,0,0,0,0,0,0,0,6.8,0
Hollywood House Melrose Place,90038.0,9.0,7.5,7.0,7.2,7.2,8.3,7.0,8.1,3.0,1,0,0,1,0,0,0,1,0,0,0,1,0,1,0,0,0,5.6,1
Downtown Los Angeles Luxury 3-bedroom Pool Suite,90017.0,10.0,8.1,8.3,8.5,8.0,7.3,7.8,8.5,5.0,0,0,1,0,1,0,0,1,0,0,1,0,0,1,0,1,0,1.3,1
"The Standard, Hollywood",90069.0,563.0,7.8,7.9,7.7,7.4,8.2,6.9,7.8,8.7,0,0,0,0,1,0,0,1,0,1,1,0,1,1,0,1,0,7.5,0
DOWNTOWN L.A. 36 Story Breath Taking View Penthouse,90015.0,15.0,7.8,7.7,7.7,8.0,7.8,7.5,6.3,7.8,1,0,0,0,0,0,0,1,0,0,1,0,0,1,0,1,0,1.1,0
Urban Downtown LA Sapphire Suite,90017.0,5.0,8.6,9.5,8.5,8.5,8.5,8.0,8.5,3.0,0,0,1,0,1,0,0,1,0,0,1,0,0,1,0,1,0,1.2,1
Holiday Inn Express Los Angeles LAX Airport,90045.0,657.0,7.9,8.1,8.0,7.5,8.2,7.3,8.2,8.0,1,0,0,0,0,0,0,1,0,0,1,0,0,1,0,1,0,9.9,0
Hollywood Hills Suites,90028.0,50.0,7.9,7.6,7.8,7.5,7.9,7.4,7.5,9.0,1,0,0,1,0,0,0,1,0,0,0,0,0,1,1,0,0,5.6,0
EXQUISITE MARINA 2BDR SUITE WITH BALCONY & RELAXING VIEWS,90094.0,9.0,7.9,7.8,7.5,7.8,7.8,7.5,7.5,9.2,1,0,0,0,0,0,0,1,0,1,1,0,0,1,0,1,0,11.8,0
Wingate by Wyndham Los Angeles Airport,90304.0,4050.0,7.6,7.9,7.9,7.4,7.7,7.3,7.7,7.5,0,0,1,1,1,0,0,1,0,0,0,0,0,1,0,0,0,9.9,0
"Hampton Inn & Suites Los Angeles/Hollywood, CA",90038.0,85.0,8.6,9.2,8.8,8.8,8.9,7.8,8.5,7.8,0,0,1,1,1,0,0,1,0,0,1,0,0,0,0,1,0,5.0,2
Montrose West Hollywood,90069.0,458.0,7.7,7.8,8.0,7.6,7.8,6.8,5.8,8.4,0,0,0,1,1,0,0,0,0,0,1,0,1,1,0,1,0,8.1,0
Los Angeles 5 Beds Convention Pool,90015.0,24.0,7.9,8.2,8.5,7.7,7.5,7.2,10.0,8.5,1,0,0,1,0,0,0,1,0,0,1,0,0,1,0,1,0,1.5,2
Top Floor Penthouse Living Like A Rockstar,90017.0,23.0,8.1,8.1,8.1,8.3,8.2,7.5,7.8,8.3,0,0,0,1,1,1,0,1,0,0,1,0,0,0,0,1,0,1.0,0
Sheraton Universal,91608.0,1017.0,7.5,7.5,7.5,7.1,8.1,6.2,5.8,8.5,0,0,1,1,1,0,0,1,0,0,0,0,1,1,0,1,0,8.7,0
Mid City 3 Bedroom 3 Bathroom 5 Queen Beds,90019.0,11.0,8.3,8.2,8.2,8.6,8.9,8.2,10.0,7.5,1,0,0,1,0,0,1,1,0,0,0,0,0,1,0,0,0,3.7,2
The Moment Hotel,90046.0,271.0,8.0,8.3,8.0,7.8,8.4,7.0,8.1,8.3,0,1,0,1,1,0,0,1,0,0,0,0,1,1,0,0,0,6.8,0
Urban Downtown LA Luxury Resort Suite,90017.0,16.0,8.7,8.5,8.6,8.8,9.2,8.0,9.2,8.9,1,0,1,0,0,0,0,1,0,0,1,0,0,1,0,1,0,1.2,2
Jolly Roger Hotel,90292.0,1043.0,7.6,7.6,7.3,7.3,8.5,6.9,8.2,8.0,1,0,0,1,0,0,0,1,0,0,1,0,0,1,0,1,0,12.4,0
Urban Downtown LA Designer City Sky Suite,90015.0,15.0,8.0,7.5,7.5,7.8,8.0,7.9,9.1,9.0,0,0,0,1,1,0,0,1,0,0,1,0,0,1,0,1,0,1.3,0
Downtown LA VIP Resort Apartment,90017.0,9.0,7.4,7.8,7.0,7.0,7.5,7.2,2.5,8.1,1,0,1,0,0,0,0,1,0,0,1,0,0,1,0,1,0,1.2,0
Strathmore Apartments,90024.0,50.0,7.4,7.5,7.4,7.3,6.8,7.2,8.0,8.2,0,1,0,0,1,0,1,1,0,0,0,0,0,1,0,0,0,11.8,0
Executive Celebrity Suites,90017.0,41.0,8.5,8.4,8.7,8.8,8.5,8.2,9.7,8.4,1,0,1,1,0,0,0,1,0,0,0,0,0,1,0,1,0,1.2,2
Popular Downtown Los Angeles Luxurious Resort Suite,90012.0,26.0,7.9,7.5,8.3,8.3,8.0,7.5,8.3,7.9,1,0,0,0,0,0,0,1,0,0,1,0,0,1,1,1,0,0.7,0
Hollywood Hot Spot Condo,90028.0,12.0,7.5,7.5,7.1,7.1,7.9,6.9,10.0,8.6,1,0,0,1,0,0,0,1,0,0,1,0,0,1,0,1,0,6.2,0
Amazing 2bed/2 bath near the Grove,90036.0,36.0,8.3,7.5,8.2,8.3,9.0,7.7,7.5,9.3,1,0,0,0,0,0,1,1,0,0,0,0,0,1,0,0,0,5.6,0
Popular DTLA Designer Suite,90015.0,13.0,8.0,8.5,8.1,7.9,8.1,7.3,8.3,3.0,1,0,0,0,0,0,0,1,1,0,1,0,0,1,0,1,0,1.3,1
Sportsmen's Lodge Hotel,91604.0,1357.0,7.7,7.9,7.8,7.5,8.0,7.0,7.9,8.1,0,0,0,1,1,0,0,1,0,0,1,0,1,1,0,1,0,11.2,0
Popular Hollywood Blvd Magnificent Suite,90028.0,10.0,7.8,7.5,8.0,8.0,7.8,7.8,8.0,3.0,1,0,1,0,0,0,0,1,0,0,1,0,0,1,0,1,0,6.2,1
Epic Downtown Apartment,90017.0,6.0,8.2,8.8,8.3,8.3,8.3,7.9,10.0,7.5,1,0,0,1,0,1,0,1,0,0,0,0,0,1,0,1,0,1.2,2
SureStay Collection by Best Western Saharan Hotel,90046.0,1179.0,7.0,7.1,6.8,6.5,6.9,6.7,7.3,7.9,1,0,0,1,0,0,0,1,0,0,1,0,0,1,0,1,0,6.2,0
Modern Star Apartments,90017.0,16.0,8.1,8.8,8.3,8.5,8.3,7.7,8.8,7.2,1,0,1,0,0,0,0,1,0,0,1,0,0,1,0,1,0,0.6,2
Hotel Carmel By The Sea,90401.0,1247.0,7.4,7.6,6.9,6.4,8.1,6.5,7.3,9.2,0,1,0,1,1,0,0,1,0,0,0,0,0,0,0,0,1,14.3,0
Popular Hollywood Blvd Two Story Suite,90028.0,32.0,7.8,7.9,8.1,7.8,7.5,7.1,7.5,8.4,1,0,1,0,0,0,0,1,0,0,1,0,0,0,0,1,0,6.2,0
Urban Downtown LA Oasis Resort Suite,90015.0,14.0,7.5,7.2,7.3,7.0,8.7,7.0,7.5,8.0,0,0,1,0,1,0,0,1,0,0,1,0,0,1,0,1,0,1.3,0
Urban Downtown LA Pool Table Penthouse,90015.0,18.0,7.9,6.8,8.2,8.1,8.5,6.7,7.5,8.9,0,0,1,0,1,0,0,1,0,0,1,0,0,1,0,1,0,1.3,0
"The Standard, Downtown LA",90071.0,705.0,7.8,8.1,7.7,7.7,7.8,6.9,8.2,8.3,0,0,1,0,1,0,0,1,0,1,0,0,1,1,0,1,0,0.8,0
The Grove Luxury Suite,90036.0,6.0,7.9,7.1,7.9,8.3,7.9,7.5,8.8,1.0,1,0,0,1,0,0,0,1,0,0,1,0,0,1,0,1,0,6.2,1
Century Park Hotel LA,90064.0,131.0,7.4,7.8,7.4,6.9,8.0,6.8,8.4,7.7,0,1,0,1,1,0,0,1,0,0,0,1,0,1,0,0,0,9.9,0
Hollywood City Inn,90027.0,1492.0,7.3,7.4,7.2,7.0,7.3,7.0,7.8,7.9,1,0,0,0,0,0,0,1,0,0,0,0,0,1,0,1,1,5.0,0
Private Bedroom and Bathroom in Shared 2 Bedroom Apartment,90292.0,13.0,8.2,8.5,8.3,7.9,8.5,6.9,7.5,9.2,1,0,1,0,0,0,0,1,0,0,1,0,0,1,0,1,0,13.0,0
Wellworth Apartments,90024.0,170.0,7.8,7.5,7.9,7.6,7.9,7.1,8.5,8.6,0,1,1,0,1,0,0,1,0,0,0,0,0,1,0,0,0,11.2,0
Cal Mar Hotel Suites,90403.0,657.0,7.7,7.6,7.5,7.2,8.1,6.8,3.7,8.9,0,1,0,1,1,0,0,0,0,0,0,0,0,1,0,1,0,14.9,0
Dunes Inn - Sunset,90028.0,648.0,7.5,7.8,7.2,7.0,7.7,7.4,8.2,8.1,1,0,0,1,0,0,0,1,0,0,0,1,0,1,0,0,1,5.0,0
The Dixie Hollywood,90027.0,1986.0,7.1,7.0,6.8,6.8,7.4,6.9,7.2,7.9,1,0,0,1,0,0,0,1,0,1,0,0,0,1,0,1,0,5.0,0
Hollywood Grand Apartment,90028.0,10.0,6.9,7.0,7.5,6.3,6.0,6.8,7.8,3.0,1,0,0,0,0,0,0,1,0,0,0,0,0,0,0,0,0,6.2,1
Hollywood 5 Beds Famous Awards Pool,90028.0,26.0,7.3,7.0,6.9,7.1,7.9,6.8,8.2,6.0,0,0,0,0,1,1,0,1,0,0,1,0,0,1,0,1,0,6.2,0
La Quinta Inn & Suites LAX,90045.0,4039.0,7.4,7.5,7.5,7.1,7.8,7.0,8.2,7.7,0,0,1,0,1,0,0,1,0,1,0,0,1,1,0,0,0,9.9,0
Highland Gardens Hotel,90028.0,775.0,7.0,6.4,6.6,6.5,7.3,6.3,7.7,8.6,0,0,0,1,1,0,0,1,0,0,1,0,0,1,0,1,0,6.2,0
Ramada by Wyndham Los Angeles/Downtown West,90006.0,1153.0,6.9,7.3,7.1,6.8,7.3,6.5,7.4,6.7,1,0,1,1,0,0,0,1,0,0,0,0,0,1,0,1,0,2.0,0
Hollywood Downtowner Inn,90028.0,1566.0,7.1,6.7,6.7,6.5,7.9,6.8,6.9,7.8,1,0,0,1,0,0,1,1,0,0,0,0,0,0,0,1,1,5.0,0
O Hotel,90017.0,934.0,7.5,7.8,7.3,7.2,8.0,6.7,7.5,8.3,0,0,1,0,0,0,0,1,0,0,0,0,1,1,0,0,0,1.1,0
Hotel Hwood Near the Sunset Strip,90028.0,743.0,7.5,7.6,7.3,6.8,7.6,7.2,7.8,8.6,0,1,0,0,1,0,0,1,0,0,0,0,0,1,0,0,0,6.2,0
Penthouse Los Angeles Convention Resort Suite Pool,90015.0,24.0,7.7,8.1,8.2,8.2,7.0,7.0,8.8,7.5,1,0,0,0,0,0,0,1,0,0,1,0,0,1,1,1,0,1.5,0
Luxury Private 2 bedroom Condo,90036.0,13.0,7.4,7.3,7.7,6.5,7.5,7.1,8.5,4.0,1,0,0,1,0,0,0,1,0,0,1,0,0,1,0,1,0,6.2,1
Hollywood Inn Express North,90027.0,1243.0,7.2,7.3,7.1,6.8,7.2,7.1,6.9,7.5,1,0,0,1,0,0,0,1,0,0,0,0,0,1,0,1,0,4.3,0
Hollywood and Sunset Furnished Apartments,90028.0,64.0,8.4,8.1,8.5,8.5,8.0,8.1,9.5,9.2,1,0,0,1,0,0,0,1,0,0,1,0,0,1,0,1,0,6.2,2
Step to the beach,90292.0,6.0,6.2,6.7,5.4,6.3,6.3,4.6,7.9,1.0,1,0,0,1,0,0,0,1,0,0,1,0,0,1,0,1,0,13.0,1
Dunes Inn - Wilshire,90010.0,449.0,7.3,7.6,7.1,6.9,7.2,7.0,7.2,7.8,1,0,0,1,0,0,0,1,0,0,0,1,0,1,0,1,0,4.3,0
Chic Hollywood home - central to everything,90038.0,5.0,8.1,9.0,9.0,6.5,6.5,8.5,9.0,2.0,1,0,0,1,0,0,1,1,0,0,0,0,0,0,0,0,0,4.3,1
Corporate Suites in Downtown LA near Staples Center,90015.0,126.0,7.2,7.2,7.5,7.3,6.7,6.8,8.9,7.8,1,0,0,1,0,0,0,1,0,0,1,0,0,1,0,1,0,1.3,0
Hollywood Blvd Walk of Fame Apartment,90028.0,9.0,7.5,7.5,7.5,7.8,6.1,7.0,8.9,2.0,1,0,1,0,0,0,0,1,1,0,0,1,0,1,0,0,0,6.2,1
Ocean Suites - Coral,90405.0,36.0,8.5,8.4,8.3,8.2,8.7,8.1,9.5,9.5,1,0,0,0,0,0,0,1,0,0,0,0,0,1,0,0,0,14.3,2
Studio City Courtyard Hotel,91604.0,1021.0,7.2,7.1,7.0,6.7,7.8,6.8,7.9,7.8,0,0,0,1,1,0,0,1,0,0,1,0,0,1,0,1,0,11.2,0
Hotel Solaire Los Angeles,90017.0,1592.0,7.0,7.1,7.0,6.8,8.0,6.7,7.9,6.3,0,1,0,1,1,0,0,1,0,0,0,0,0,1,0,1,0,1.7,0
Private Hollywood 4Br Villa at Melrose,90036.0,7.0,7.8,7.2,7.9,7.5,8.2,7.9,7.9,4.0,1,0,0,1,0,0,0,1,0,1,0,0,0,1,0,0,0,5.6,1
Hollywood Inn Express South,90026.0,2061.0,6.2,6.5,6.3,5.9,6.5,6.0,6.2,6.3,1,0,0,1,0,0,0,1,0,0,1,0,0,1,0,1,0,1.9,0
Sunburst Spa & Suites Motel,90230.0,320.0,7.2,7.3,7.2,6.8,7.5,6.7,7.5,7.5,1,0,0,1,0,0,1,1,0,0,0,0,0,1,0,0,1,9.9,0
Popular Hollywood Blvd Premier Suite,90028.0,6.0,6.7,7.1,6.7,6.3,6.7,6.7,7.1,1.0,1,0,1,0,0,0,0,1,0,0,1,0,0,1,0,1,0,5.6,1
Downtown LA Gorgeous Resort Style Suite,90017.0,29.0,7.3,6.8,7.3,6.9,7.4,7.1,10.0,8.2,1,0,0,1,0,0,0,1,0,0,1,0,0,1,0,1,0,1.2,0
Fully furnished apartment in la close to Beverly Hills,90035.0,87.0,7.2,7.0,7.1,7.1,7.1,7.2,7.2,7.9,1,0,0,1,0,0,1,1,1,0,0,0,0,1,0,0,0,7.5,0
Luxury Downtown Vacation Home with Parking,90017.0,6.0,9.7,10.0,10.0,10.0,9.6,9.6,9.2,5.0,1,0,0,0,0,1,0,1,0,0,1,0,0,1,0,1,0,1.2,1
Westwood Two Bedroom #2,90024.0,21.0,9.3,9.4,9.2,9.2,9.7,8.6,9.0,9.5,1,0,0,1,0,1,0,1,0,0,0,0,0,1,0,1,0,11.2,2
Ocean Park Hotel,90405.0,1965.0,7.4,7.8,6.8,6.7,8.5,7.0,7.8,7.6,1,0,0,0,0,0,0,1,1,0,0,0,0,1,0,0,0,11.8,0
Modern 3 bedrooms 2 bathrooms Mid City,90006.0,5.0,7.9,8.5,8.5,8.5,8.0,7.0,7.0,1.0,1,0,0,1,0,0,1,1,0,0,0,0,0,1,0,0,0,3.1,1
Downtown LA City View Suite,90017.0,13.0,7.8,7.9,7.7,7.9,7.5,7.7,10.0,7.9,1,0,1,0,0,0,0,1,0,0,1,0,0,1,0,1,0,1.2,0
Gateway Hotel Santa Monica,90404.0,1178.0,8.2,8.7,8.3,7.9,8.7,7.6,8.7,8.0,0,1,1,0,1,0,0,1,0,0,0,1,0,1,0,0,0,13.7,0
Hollywood Walk of Fame Furnished Apartments,90028.0,52.0,7.0,6.6,7.0,6.6,6.6,6.5,9.3,8.4,1,0,0,1,0,0,0,1,0,0,1,0,0,1,0,1,0,5.6,0
Luxury Studio Next to LA Live,90015.0,7.0,6.1,6.8,6.8,6.4,4.7,4.3,10.0,7.5,1,0,0,0,0,0,0,1,0,1,1,0,0,1,0,1,0,1.3,0
Avalon Hotel Beverly Hills,90212.0,233.0,7.7,8.0,7.7,7.4,8.2,6.7,8.6,8.3,0,0,0,1,1,0,0,1,0,1,0,0,1,1,0,1,0,8.7,0
Loews Santa Monica Beach Hotel,90401.0,950.0,8.6,9.0,8.9,8.7,8.5,7.1,8.2,9.3,0,0,0,1,1,0,0,1,0,0,1,0,1,1,0,1,0,14.3,2
Ginosi Metropolitan Apartel,90028.0,96.0,8.1,8.0,8.2,8.0,8.2,7.6,8.5,8.4,0,0,1,1,1,0,0,1,0,1,0,0,0,1,0,0,0,5.0,0
Holiday Inn Los Angeles - LAX Airport,90045.0,1352.0,7.0,7.2,7.2,6.7,7.4,6.3,7.1,7.4,0,0,1,0,1,0,0,1,0,0,0,0,1,1,0,1,0,9.9,0
Chateau Marmont,90046.0,355.0,8.7,9.0,8.9,8.7,8.8,7.5,8.8,9.3,0,0,0,0,1,0,0,1,0,1,1,0,1,0,0,1,0,7.5,2
Walk of Fame Apartment in Hollywood,90028.0,44.0,7.6,7.3,7.1,7.6,6.9,7.5,8.3,9.2,1,0,1,0,0,0,0,1,0,0,1,1,0,0,0,1,0,6.2,0
Fabulous Walk of Fame Apartment in Hollywood,90028.0,46.0,7.7,7.5,7.5,7.4,7.5,7.1,9.4,9.1,1,0,1,0,0,0,0,1,0,0,1,0,0,1,0,1,0,6.2,0
Walk of Fame Suite in Hollywood,90028.0,8.0,6.3,6.0,6.6,5.6,5.6,5.6,8.1,1.0,1,0,1,0,0,0,0,1,0,0,1,0,0,1,0,1,0,5.6,1
Jamaica Bay Inn,90292.0,191.0,8.5,9.0,8.7,8.4,8.6,7.2,9.2,9.0,0,0,0,1,1,0,0,1,0,0,1,0,1,1,0,1,0,13.0,2
The Mayfair Hotel,90017.0,1621.0,6.9,7.2,7.0,6.3,7.5,6.5,8.0,6.7,0,1,0,0,1,0,0,1,0,0,0,0,0,1,0,0,1,1.4,0
Hollywood Bed & Breakfast,90046.0,115.0,9.2,9.6,9.2,9.1,9.6,8.6,9.2,9.3,1,0,0,1,0,0,0,1,0,0,1,0,0,1,0,1,0,7.5,2
Shutters On The Beach,90405.0,464.0,8.8,9.3,9.1,8.8,8.9,7.2,9.4,8.6,0,0,0,0,1,0,0,0,0,1,0,0,1,1,0,1,0,14.3,2
Noon on Sunset Hill,90026.0,37.0,8.4,8.8,8.9,8.6,7.6,8.2,9.5,8.4,0,0,0,0,0,0,1,1,1,0,0,0,0,1,0,0,0,1.7,2
Ocean Suites - Sail,90405.0,20.0,9.4,9.8,9.0,9.4,9.4,8.8,8.8,9.9,1,0,0,0,0,0,0,1,0,0,0,0,0,1,0,0,0,14.3,2
Fully Furnished Apt in LA Downtown,90010.0,52.0,7.9,8.0,8.4,7.8,7.3,7.5,8.8,8.3,1,0,0,1,0,0,0,1,0,0,1,0,0,1,0,1,0,2.9,0
Hollywood 6 Beds Superstar Pool,90028.0,30.0,7.8,7.3,7.7,7.9,7.8,7.3,9.4,8.6,0,1,0,0,1,0,0,1,0,0,1,0,0,1,0,1,0,5.6,0
Miyako Hotel Los Angeles,90012.0,783.0,8.3,8.7,8.6,8.1,8.8,7.5,8.5,8.4,0,1,0,0,1,0,0,1,0,0,0,0,1,1,0,0,0,1300.0,2
Best Western Airport Plaza Inn,90302.0,849.0,7.5,7.8,7.5,7.2,8.1,7.2,8.4,7.2,0,1,0,1,1,0,0,1,0,0,0,0,0,1,0,0,0,8.7,0
Hollywood Celebrity Hotel,90028.0,1715.0,8.7,8.8,8.3,8.2,9.3,8.0,8.3,9.5,0,1,0,1,1,1,0,1,0,0,0,0,0,1,0,0,0,6.2,2
Hollywood Orchid Suites,90028.0,687.0,9.0,9.0,8.9,8.7,9.4,8.6,7.9,9.6,0,1,0,1,1,0,0,1,0,0,0,0,0,1,0,1,0,6.2,2
Ocean Suites - Sand,90405.0,17.0,8.5,8.2,8.1,8.2,8.7,8.0,7.5,9.9,1,0,0,0,0,0,0,1,0,0,0,0,0,1,0,0,0,14.3,0
Villa Brasil Motel,90066.0,34.0,9.2,9.3,9.1,9.0,9.5,9.0,8.5,9.1,1,0,0,0,0,0,0,1,0,1,0,0,1,1,0,0,0,10.6,2
Venice Beach Suites & Hotel,90291.0,347.0,8.2,8.2,7.8,7.7,9.2,7.1,9.1,9.0,0,0,0,0,1,0,0,1,1,0,0,0,0,1,1,0,0,13.7,0
Hollywood Loft,90028.0,17.0,8.0,8.4,8.4,8.0,7.5,7.1,10.0,8.5,1,0,0,1,0,0,0,1,0,0,1,0,0,1,0,1,0,6.2,2
Ocean Suites - Ocean,90405.0,11.0,8.3,8.4,7.7,8.9,8.9,7.1,9.1,6.0,1,0,0,0,0,0,0,1,0,0,0,0,0,1,0,0,0,14.3,1
Downtown LA Superb 5 Beds 2 BR Pool,90017.0,10.0,7.9,8.5,8.3,8.0,7.5,7.5,5.0,7.5,0,1,1,0,1,0,0,1,0,0,1,0,0,0,0,1,0,1.3,0
Hollywood Bellucci Apartment,90028.0,57.0,8.0,8.1,8.1,8.0,7.9,7.8,10.0,8.4,0,0,1,1,1,0,0,1,0,1,0,0,0,1,0,0,0,5.0,2
Ocean Style Studio Venice Beach,90292.0,6.0,7.7,7.5,7.5,7.9,8.3,6.7,10.0,8.3,1,0,1,0,0,0,0,1,0,0,1,0,0,1,0,1,0,13.0,0
Travelodge by Wyndham Santa Monica,90405.0,1440.0,8.0,8.5,8.0,7.9,8.7,7.4,8.4,7.8,1,0,0,1,0,0,0,1,0,0,0,1,0,1,0,0,1,11.8,0
Westwood Two Bedroom #1,90024.0,12.0,9.3,9.6,9.6,9.2,9.4,8.3,10.0,9.8,1,0,0,1,0,1,0,1,0,0,1,0,0,0,0,1,0,11.2,2
Ocean Suites - Sunset,90405.0,23.0,9.0,8.8,9.0,8.8,9.3,8.2,8.3,9.7,1,0,0,0,0,0,0,1,0,0,0,0,0,1,0,0,0,14.3,2
Ocean Suites - Shell,90405.0,16.0,8.9,8.6,8.9,8.8,8.8,8.6,9.7,8.6,1,0,0,0,0,0,0,1,0,0,0,0,0,1,0,0,0,14.3,2
The Kinney - Venice Beach,90292.0,915.0,8.6,9.1,9.0,8.5,8.9,7.9,8.2,8.4,0,0,0,1,1,0,0,0,0,0,1,0,0,1,0,1,0,12.4,2
Amazing Apartment in Santa Monica,90025.0,27.0,7.4,7.2,7.5,7.1,7.7,6.7,10.0,8.1,1,0,0,0,0,1,0,1,0,0,1,0,0,1,0,1,0,12.4,0
Boutique Citrus Apartments,90028.0,11.0,9.1,9.3,9.1,8.9,9.1,9.1,10.0,9.3,1,0,0,0,0,0,1,1,0,0,0,0,0,1,0,0,0,6.2,2
Bayside Hotel,90405.0,1387.0,7.9,8.1,7.9,7.4,8.0,6.9,7.9,9.1,0,0,0,1,1,0,0,1,0,1,0,0,0,1,0,0,0,14.3,0
Downtown Victorian PH 6Beds W Pools,90017.0,23.0,7.0,7.3,7.5,6.6,6.5,6.5,9.2,7.5,0,1,0,0,1,0,0,1,0,0,1,0,0,1,0,1,0,1.2,0
Venice House on the Canals,90291.0,11.0,8.5,7.3,9.1,8.0,8.3,8.4,10.0,9.8,1,0,0,0,0,0,1,1,0,0,0,0,0,0,1,0,0,13.0,2
Hilgard House Westwood Village,90024.0,353.0,8.2,8.2,8.2,7.6,8.7,7.5,8.4,9.1,0,1,0,0,1,0,0,1,1,0,0,0,0,1,0,0,1,11.2,0
West Hollywood Studio,90069.0,9.0,9.2,9.7,9.1,10.0,9.2,8.5,8.8,7.0,1,0,0,0,0,0,0,1,1,0,0,0,0,1,1,0,0,8.1,2
